{
  "format": "rigel-backup",
  "schema_version": 1,
  "created_at": "2026-10-25T20:15:00Z",
  "app": {
    "name": "Rigel",
    "version": "1.0.0"
  },
  "entries": [
    {
      "id": "0b8b2d55-2f0a-4e2c-a8d9-6a8f6d1f7e01",
      "type": "totp",
      "issuer": "Example",
      "account": "alice@example.com",
      "secret": "GEZDGNBVGY3TQOJQGEZDGNBVGY3TQOJQ",
      "algorithm": "SHA1",
      "digits": 6,
      "period": 30,
      "time_offset_s": 0,
      "websites": [
        "example.com"
      ],
      "apps": [
        {
          "platform": "android",
          "id": "com.example.app"
        }
      ],
      "tags": [
        "work"
      ],
      "favorite": false,
      "sort_key": "a0",
      "icon": {
        "source": "builtin",
        "id": "example"
      },
      "note": "",
      "created_at": "2026-10-25T20:15:00Z",
      "updated_at": "2026-10-25T20:15:00Z"
    },
    {
      "id": "7d3f0a52-6c4e-4b1a-9d3e-1f2a3b4c5d6e",
      "type": "hotp",
      "issuer": "Counter",
      "account": "bob",
      "secret": "GEZDGNBVGY3TQOJQGEZDGNBVGY3TQOJQ",
      "algorithm": "SHA1",
      "digits": 6,
      "counter": 0
    },
    {
      "id": "a1b2c3d4-e5f6-4a7b-8c9d-0e1f2a3b4c5d",
      "type": "steam",
      "issuer": "Steam",
      "account": "carol",
      "secret": "GEZDGNBVGY3TQOJQGEZDGNBVGY3TQOJQ",
      "algorithm": "SHA1",
      "digits": 5,
      "period": 30
    },
    {
      "id": "c0ffee00-1234-4abc-8def-0123456789ab",
      "type": "totp",
      "issuer": "Strong",
      "account": "dave",
      "secret": "GEZDGNBVGY3TQOJQGEZDGNBVGY3TQOJQ",
      "algorithm": "SHA512",
      "digits": 8,
      "period": 60,
      "time_offset_s": -5
    }
  ],
  "source_vault_id": "5f0c6f1e-3a52-4c1e-9a43-2a8f0f9f4b10",
  "settings": {
    "hide_codes": false,
    "clipboard_clear_s": 30
  }
}
